{
  "schema_version": "schema_v1",
  "experiment_id": "benchmark_v1",
  "benchmark_version": "v0.1",
  "split": "eval",
  "systems": [
    "text_only_v1",
    "code_only_v1",
    "naive_concat_v1",
    "full_method_v1"
  ],
  "providers": [
    "configs/providers/openai.json",
    "configs/providers/anthropic.json"
  ],
  "seeds": [1, 2, 3],
  "generation_parameters": {
    "temperature": 0.0,
    "max_tokens": 2048
  },
  "notes": "Full benchmark eval. Three seeds per (system, provider, instance) triple. Results feed paper-ready tables and figures."
}
